logs/history_best_1080.log
{"i": ["cuda -model=1080", "topi_nn_conv2d", [["TENSOR", [1, 64, 56, 56], "int8"], ["TENSOR", [64, 64, 1, 1], "int8"], [1, 1], [0, 0], [1, 1], "NCHW", "int32"], {}, ["conv2d", [1, 64, 56, 56, "int8"], [64, 64, 1, 1, "int8"], [1, 1], [0, 0], [1, 1], "NCHW", "int32"], {"i": 59889521, "t": "int8", "c": null, "e": [["tile_n", "sp", [1, 1, 1, 1]], ["tile_f", "sp", [4, 2, 2, 1]], ["tile_y", "sp", [14, 2, 2, 1]], ["tile_x", "sp", [1, 1, 56, 1]], ["fuse_yx", "ot", 1], ["tile_rc", "sp", [2, 8]], ["tile_ry", "sp", [1, 1]], ["tile_rx", "sp", [1, 1]], ["reorder_inner", "re", [1, 0, 2]], ["AA_double_buffer", "ot", 0], ["WW_double_buffer", "ot", 0], ["auto_unroll_max_step", "ot", 512]]}], "r": [[5.2057e-06], 0, 1.0827958583831787, 1545283619.639385], "v": 0.1}
{"i": ["cuda -model=1080", "topi_nn_conv2d", [["TENSOR", [1, 1024, 14, 14], "int8"], ["TENSOR", [512, 1024, 1, 1], "int8"], [2, 2], [0, 0], [1, 1], "NCHW", "int32"], {}, ["conv2d", [1, 1024, 14, 14, "int8"], [512, 1024, 1, 1, "int8"], [2, 2], [0, 0], [1, 1], "NCHW", "int32"], {"i": 982095, "t": "int8", "c": null, "e": [["tile_n", "sp", [1, 1, 1, 1]], ["tile_f", "sp", [32, 1, 4, 1]], ["tile_y", "sp", [7, 1, 1, 1]], ["tile_x", "sp", [1, 1, 7, 1]], ["fuse_yx", "ot", 1], ["tile_rc", "sp", [32, 8]], ["tile_ry", "sp", [1, 1]], ["tile_rx", "sp", [1, 1]], ["reorder_inner", "re", [2, 0, 1]], ["AA_double_buffer", "ot", 0], ["WW_double_buffer", "ot", 0], ["auto_unroll_max_step", "ot", 512]]}], "r": [[2.08577e-05], 0, 0.945915937423706, 1545377339.751529], "v": 0.1}
{"i": ["cuda -model=1080", "topi_nn_conv2d", [["TENSOR", [1, 512, 7, 7], "int8"], ["TENSOR", [512, 512, 3, 3], "int8"], [1, 1], [1, 1], [1, 1], "NCHW", "int32"], {}, ["conv2d", [1, 512, 7, 7, "int8"], [512, 512, 3, 3, "int8"], [1, 1], [1, 1], [1, 1], "NCHW", "int32"], {"i": 143288, "t": "int8", "c": null, "e": [["tile_n", "sp", [1, 1, 1, 1]], ["tile_f", "sp", [64, 1, 2, 1]], ["tile_y", "sp", [1, 1, 7, 1]], ["tile_x", "sp", [1, 1, 7, 1]], ["fuse_yx", "ot", 0], ["tile_rc", "sp", [4, 32]], ["tile_ry", "sp", [3, 1]], ["tile_rx", "sp", [3, 1]], ["reorder_inner", "re", [0, 2, 1]], ["AA_double_buffer", "ot", 0], ["WW_double_buffer", "ot", 0], ["auto_unroll_max_step", "ot", 0]]}], "r": [[6.10794e-05], 0, 0.9062049388885498, 1545386543.39337], "v": 0.1}
{"i": ["cuda -model=1080", "topi_nn_conv2d", [["TENSOR", [1, 512, 14, 14], "int8"], ["TENSOR", [512, 512, 3, 3], "int8"], [1, 1], [1, 1], [1, 1], "NCHW", "int32"], {}, ["conv2d", [1, 512, 14, 14, "int8"], [512, 512, 3, 3, "int8"], [1, 1], [1, 1], [1, 1], "NCHW", "int32"], {"i": 53714061, "t": "int8", "c": null, "e": [["tile_n", "sp", [1, 1, 1, 1]], ["tile_f", "sp", [16, 1, 8, 1]], ["tile_y", "sp", [7, 2, 1, 1]], ["tile_x", "sp", [1, 1, 14, 1]], ["fuse_yx", "ot", 0], ["tile_rc", "sp", [32, 4]], ["tile_ry", "sp", [1, 3]], ["tile_rx", "sp", [3, 1]], ["reorder_inner", "re", [1, 2, 0]], ["AA_double_buffer", "ot", 0], ["WW_double_buffer", "ot", 0], ["auto_unroll_max_step", "ot", 512]]}], "r": [[8.56661e-05], 0, 0.8680250644683838, 1545896597.889072], "v": 0.1}
{"i": ["cuda -model=1080", "topi_nn_group_conv2d_nchw", [["TENSOR", [32, 256, 56, 56], "int8"], ["TENSOR", [256, 8, 3, 3], "int8"], [2, 2], [1, 1], [1, 1], 32, "int32"], {}, ["group_conv2d_nchw", [32, 256, 56, 56, "int8"], [256, 8, 3, 3, "int8"], [2, 2], [1, 1], [1, 1], 32, "int32"], {"i": 267577653, "t": "int8", "c": null, "e": [["tile_n", "sp", [16, 1, 1, 2]], ["tile_g", "sp", [32, 1]], ["tile_f", "sp", [1, 1, 2, 1]], ["tile_y", "sp", [7, 1, 4, 1]], ["tile_x", "sp", [1, 1, 28, 1]], ["fuse_yx", "ot", 0], ["tile_rc", "sp", [2, 1]], ["tile_ry", "sp", [1, 3]], ["tile_rx", "sp", [1, 3]], ["AA_double_buffer", "ot", 1], ["WW_double_buffer", "ot", 1], ["auto_unroll_max_step", "ot", 512], ["reorder_inner", "re", [0, 1, 2]]]}], "r": [[0.0002213633], 0, 1.1309809684753418, 1541566342.056195], "v": 0.1}
{"i": ["cuda -model=1080", "topi_nn_group_conv2d_nchw", [["TENSOR", [32, 128, 56, 56], "int8"], ["TENSOR", [128, 4, 3, 3], "int8"], [1, 1], [1, 1], [1, 1], 32, "int32"], {}, ["group_conv2d_nchw", [32, 128, 56, 56, "int8"], [128, 4, 3, 3, "int8"], [1, 1], [1, 1], [1, 1], 32, "int32"], {"i": 56700336, "t": "int8", "c": null, "e": [["tile_n", "sp", [32, 1, 1, 1]], ["tile_g", "sp", [32, 1]], ["tile_f", "sp", [1, 1, 1, 1]], ["tile_y", "sp", [14, 2, 1, 2]], ["tile_x", "sp", [1, 1, 56, 1]], ["fuse_yx", "ot", 0], ["tile_rc", "sp", [1, 1]], ["tile_ry", "sp", [1, 3]], ["tile_rx", "sp", [3, 1]], ["AA_double_buffer", "ot", 1], ["WW_double_buffer", "ot", 1], ["auto_unroll_max_step", "ot", 0], ["reorder_inner", "re", [0, 1, 2]]]}], "r": [[0.00014830399999999998], 0, 0.887200117111206, 1541582662.422141], "v": 0.1}
{"i": ["cuda -model=1080", "topi_nn_group_conv2d_nchw", [["TENSOR", [32, 256, 56, 56], "int8"], ["TENSOR", [256, 8, 3, 3], "int8"], [1, 1], [1, 1], [1, 1], 32, "int32"], {}, ["group_conv2d_nchw", [32, 256, 56, 56, "int8"], [256, 8, 3, 3, "int8"], [1, 1], [1, 1], [1, 1], 32, "int32"], {"i": 1009547952, "t": "int8", "c": null, "e": [["tile_n", "sp", [32, 1, 1, 1]], ["tile_g", "sp", [32, 1]], ["tile_f", "sp", [1, 1, 1, 2]], ["tile_y", "sp", [14, 2, 1, 2]], ["tile_x", "sp", [1, 1, 56, 1]], ["fuse_yx", "ot", 1], ["tile_rc", "sp", [2, 1]], ["tile_ry", "sp", [1, 3]], ["tile_rx", "sp", [3, 1]], ["AA_double_buffer", "ot", 1], ["WW_double_buffer", "ot", 1], ["auto_unroll_max_step", "ot", 512], ["reorder_inner", "re", [0, 1, 2]]]}], "r": [[0.0003310665], 0, 2.144145965576172, 1541584274.373988], "v": 0.1}
{"i": ["cuda -model=1080", "topi_nn_group_conv2d_nchw", [["TENSOR", [32, 256, 28, 28], "int8"], ["TENSOR", [256, 8, 3, 3], "int8"], [1, 1], [1, 1], [1, 1], 32, "int32"], {}, ["group_conv2d_nchw", [32, 256, 28, 28, "int8"], [256, 8, 3, 3, "int8"], [1, 1], [1, 1], [1, 1], 32, "int32"], {"i": 114896208, "t": "int8", "c": null, "e": [["tile_n", "sp", [32, 1, 1, 1]], ["tile_g", "sp", [32, 1]], ["tile_f", "sp", [1, 2, 1, 1]], ["tile_y", "sp", [2, 7, 2, 1]], ["tile_x", "sp", [1, 1, 28, 1]], ["fuse_yx", "ot", 1], ["tile_rc", "sp", [2, 1]], ["tile_ry", "sp", [1, 3]], ["tile_rx", "sp", [3, 1]], ["AA_double_buffer", "ot", 1], ["WW_double_buffer", "ot", 1], ["auto_unroll_max_step", "ot", 0], ["reorder_inner", "re", [0, 1, 2]]]}], "r": [[9.07266e-05], 0, 0.9847228527069092, 1541587555.193968], "v": 0.1}
{"i": ["cuda -model=1080", "topi_nn_group_conv2d_nchw", [["TENSOR", [32, 512, 28, 28], "int8"], ["TENSOR", [512, 16, 3, 3], "int8"], [2, 2], [1, 1], [1, 1], 32, "int32"], {}, ["group_conv2d_nchw", [32, 512, 28, 28, "int8"], [512, 16, 3, 3, "int8"], [2, 2], [1, 1], [1, 1], 32, "int32"], {"i": 162168384, "t": "int8", "c": null, "e": [["tile_n", "sp", [32, 1, 1, 1]], ["tile_g", "sp", [32, 1]], ["tile_f", "sp", [1, 2, 2, 1]], ["tile_y", "sp", [1, 1, 14, 1]], ["tile_x", "sp", [1, 1, 14, 1]], ["fuse_yx", "ot", 0], ["tile_rc", "sp", [2, 2]], ["tile_ry", "sp", [1, 3]], ["tile_rx", "sp", [1, 3]], ["AA_double_buffer", "ot", 1], ["WW_double_buffer", "ot", 1], ["auto_unroll_max_step", "ot", 512], ["reorder_inner", "re", [0, 1, 2]]]}], "r": [[0.0001568086], 0, 1.0872650146484375, 1541601576.412484], "v": 0.1}
{"i": ["cuda -model=1080", "topi_nn_group_conv2d_nchw", [["TENSOR", [32, 512, 14, 14], "int8"], ["TENSOR", [512, 16, 3, 3], "int8"], [1, 1], [1, 1], [1, 1], 32, "int32"], {}, ["group_conv2d_nchw", [32, 512, 14, 14, "int8"], [512, 16, 3, 3, "int8"], [1, 1], [1, 1], [1, 1], 32, "int32"], {"i": 150114050, "t": "int8", "c": null, "e": [["tile_n", "sp", [8, 4, 1, 1]], ["tile_g", "sp", [32, 1]], ["tile_f", "sp", [1, 1, 2, 2]], ["tile_y", "sp", [7, 1, 2, 1]], ["tile_x", "sp", [1, 1, 14, 1]], ["fuse_yx", "ot", 0], ["tile_rc", "sp", [4, 1]], ["tile_ry", "sp", [1, 3]], ["tile_rx", "sp", [3, 1]], ["AA_double_buffer", "ot", 1], ["WW_double_buffer", "ot", 1], ["auto_unroll_max_step", "ot", 512], ["reorder_inner", "re", [0, 1, 2]]]}], "r": [[6.69378e-05], 0, 0.9857699871063232, 1541608809.431036], "v": 0.1}
{"i": ["cuda -model=1080", "topi_nn_group_conv2d_nchw", [["TENSOR", [32, 1024, 14, 14], "int8"], ["TENSOR", [1024, 32, 3, 3], "int8"], [2, 2], [1, 1], [1, 1], 32, "int32"], {}, ["group_conv2d_nchw", [32, 1024, 14, 14, "int8"], [1024, 32, 3, 3, "int8"], [2, 2], [1, 1], [1, 1], 32, "int32"], {"i": 16412929, "t": "int8", "c": null, "e": [["tile_n", "sp", [16, 2, 1, 1]], ["tile_g", "sp", [32, 1]], ["tile_f", "sp", [1, 2, 4, 1]], ["tile_y", "sp", [1, 1, 7, 1]], ["tile_x", "sp", [1, 1, 7, 1]], ["fuse_yx", "ot", 0], ["tile_rc", "sp", [8, 1]], ["tile_ry", "sp", [1, 3]], ["tile_rx", "sp", [1, 3]], ["AA_double_buffer", "ot", 0], ["WW_double_buffer", "ot", 0], ["auto_unroll_max_step", "ot", 512], ["reorder_inner", "re", [0, 1, 2]]]}], "r": [[0.0001500796], 0, 0.9656431674957275, 1541614748.184376], "v": 0.1}
{"i": ["cuda -model=1080", "topi_nn_group_conv2d_nchw", [["TENSOR", [32, 1024, 7, 7], "int8"], ["TENSOR", [1024, 32, 3, 3], "int8"], [1, 1], [1, 1], [1, 1], 32, "int32"], {}, ["group_conv2d_nchw", [32, 1024, 7, 7, "int8"], [1024, 32, 3, 3, "int8"], [1, 1], [1, 1], [1, 1], 32, "int32"], {"i": 20928117, "t": "int8", "c": null, "e": [["tile_n", "sp", [16, 1, 1, 2]], ["tile_g", "sp", [32, 1]], ["tile_f", "sp", [1, 4, 2, 1]], ["tile_y", "sp", [1, 1, 7, 1]], ["tile_x", "sp", [1, 1, 7, 1]], ["fuse_yx", "ot", 0], ["tile_rc", "sp", [4, 2]], ["tile_ry", "sp", [3, 1]], ["tile_rx", "sp", [3, 1]], ["AA_double_buffer", "ot", 0], ["WW_double_buffer", "ot", 1], ["auto_unroll_max_step", "ot", 512], ["reorder_inner", "re", [0, 1, 2]]]}], "r": [[8.03704e-05], 0, 1.0087101459503174, 1541624888.278489], "v": 0.1}
{"i": ["cuda -model=1080", "topi_nn_conv2d", [["TENSOR", [32, 64, 56, 56], "int8"], ["TENSOR", [128, 64, 1, 1], "int8"], [1, 1], [0, 0], [1, 1], "NCHW", "int32"], {}, ["conv2d", [32, 64, 56, 56, "int8"], [128, 64, 1, 1, "int8"], [1, 1], [0, 0], [1, 1], "NCHW", "int32"], {"i": 1492513792, "t": "int8", "c": null, "e": [["tile_n", "sp", [32, 1, 1, 1]], ["tile_f", "sp", [4, 4, 2, 1]], ["tile_y", "sp", [14, 2, 2, 1]], ["tile_x", "sp", [1, 1, 56, 1]], ["fuse_yx", "ot", 0], ["tile_rc", "sp", [4, 4]], ["tile_ry", "sp", [1, 1]], ["tile_rx", "sp", [1, 1]], ["AA_double_buffer", "ot", 1], ["WW_double_buffer", "ot", 1], ["auto_unroll_max_step", "ot", 512], ["reorder_inner", "re", [0, 1, 2]]]}], "r": [[0.0001357585], 0, 1.3371849060058594, 1541660608.586065], "v": 0.1}
{"i": ["cuda -model=1080", "topi_nn_conv2d", [["TENSOR", [32, 64, 56, 56], "int8"], ["TENSOR", [256, 64, 1, 1], "int8"], [1, 1], [0, 0], [1, 1], "NCHW", "int32"], {}, ["conv2d", [32, 64, 56, 56, "int8"], [256, 64, 1, 1, "int8"], [1, 1], [0, 0], [1, 1], "NCHW", "int32"], {"i": 462536537, "t": "int8", "c": null, "e": [["tile_n", "sp", [16, 2, 1, 1]], ["tile_f", "sp", [16, 2, 1, 2]], ["tile_y", "sp", [28, 1, 2, 1]], ["tile_x", "sp", [1, 1, 56, 1]], ["fuse_yx", "ot", 1], ["tile_rc", "sp", [4, 4]], ["tile_ry", "sp", [1, 1]], ["tile_rx", "sp", [1, 1]], ["AA_double_buffer", "ot", 1], ["WW_double_buffer", "ot", 0], ["auto_unroll_max_step", "ot", 0], ["reorder_inner", "re", [0, 1, 2]]]}], "r": [[0.0002361163], 0, 1.0836141109466553, 1541666190.27434], "v": 0.1}
{"i": ["cuda -model=1080", "topi_nn_conv2d", [["TENSOR", [32, 128, 56, 56], "int8"], ["TENSOR", [256, 128, 1, 1], "int8"], [1, 1], [0, 0], [1, 1], "NCHW", "int32"], {}, ["conv2d", [32, 128, 56, 56, "int8"], [256, 128, 1, 1, "int8"], [1, 1], [0, 0], [1, 1], "NCHW", "int32"], {"i": 1937683272, "t": "int8", "c": null, "e": [["tile_n", "sp", [32, 1, 1, 1]], ["tile_f", "sp", [8, 1, 4, 2]], ["tile_y", "sp", [14, 4, 1, 1]], ["tile_x", "sp", [1, 1, 56, 1]], ["fuse_yx", "ot", 0], ["tile_rc", "sp", [8, 4]], ["tile_ry", "sp", [1, 1]], ["tile_rx", "sp", [1, 1]], ["AA_double_buffer", "ot", 1], ["WW_double_buffer", "ot", 0], ["auto_unroll_max_step", "ot", 512], ["reorder_inner", "re", [0, 1, 2]]]}], "r": [[0.0004039531], 0, 0.9390377998352051, 1541674086.710033], "v": 0.1}
{"i": ["cuda -model=1080", "topi_nn_conv2d", [["TENSOR", [32, 256, 56, 56], "int8"], ["TENSOR", [128, 256, 1, 1], "int8"], [1, 1], [0, 0], [1, 1], "NCHW", "int32"], {}, ["conv2d", [32, 256, 56, 56, "int8"], [128, 256, 1, 1, "int8"], [1, 1], [0, 0], [1, 1], "NCHW", "int32"], {"i": 1312003896, "t": "int8", "c": null, "e": [["tile_n", "sp", [32, 1, 1, 1]], ["tile_f", "sp", [2, 1, 8, 2]], ["tile_y", "sp", [14, 1, 1, 4]], ["tile_x", "sp", [1, 1, 56, 1]], ["fuse_yx", "ot", 1], ["tile_rc", "sp", [4, 16]], ["tile_ry", "sp", [1, 1]], ["tile_rx", "sp", [1, 1]], ["AA_double_buffer", "ot", 0], ["WW_double_buffer", "ot", 0], ["auto_unroll_max_step", "ot", 512], ["reorder_inner", "re", [0, 1, 2]]]}], "r": [[0.0003442545], 0, 1.1375689506530762, 1541679801.519749], "v": 0.1}
{"i": ["cuda -model=1080", "topi_nn_conv2d", [["TENSOR", [32, 256, 56, 56], "int8"], ["TENSOR", [256, 256, 1, 1], "int8"], [1, 1], [0, 0], [1, 1], "NCHW", "int32"], {}, ["conv2d", [32, 256, 56, 56, "int8"], [256, 256, 1, 1, "int8"], [1, 1], [0, 0], [1, 1], "NCHW", "int32"], {"i": 2719676456, "t": "int8", "c": null, "e": [["tile_n", "sp", [32, 1, 1, 1]], ["tile_f", "sp", [4, 1, 8, 2]], ["tile_y", "sp", [14, 4, 1, 1]], ["tile_x", "sp", [2, 1, 28, 1]], ["fuse_yx", "ot", 0], ["tile_rc", "sp", [8, 8]], ["tile_ry", "sp", [1, 1]], ["tile_rx", "sp", [1, 1]], ["AA_double_buffer", "ot", 0], ["WW_double_buffer", "ot", 1], ["auto_unroll_max_step", "ot", 512], ["reorder_inner", "re", [0, 1, 2]]]}], "r": [[0.0006646956], 0, 1.1377198696136475, 1541687311.963024], "v": 0.1}
{"i": ["cuda -model=1080", "topi_nn_conv2d", [["TENSOR", [32, 256, 56, 56], "int8"], ["TENSOR", [512, 256, 1, 1], "int8"], [2, 2], [0, 0], [1, 1], "NCHW", "int32"], {}, ["conv2d", [32, 256, 56, 56, "int8"], [512, 256, 1, 1, "int8"], [2, 2], [0, 0], [1, 1], "NCHW", "int32"], {"i": 660176069, "t": "int8", "c": null, "e": [["tile_n", "sp", [16, 1, 1, 2]], ["tile_f", "sp", [4, 1, 16, 2]], ["tile_y", "sp", [28, 1, 1, 1]], ["tile_x", "sp", [1, 2, 14, 1]], ["fuse_yx", "ot", 1], ["tile_rc", "sp", [16, 4]], ["tile_ry", "sp", [1, 1]], ["tile_rx", "sp", [1, 1]], ["AA_double_buffer", "ot", 0], ["WW_double_buffer", "ot", 0], ["auto_unroll_max_step", "ot", 512], ["reorder_inner", "re", [0, 1, 2]]]}], "r": [[0.000557312], 0, 0.919888973236084, 1541692456.982951], "v": 0.1}
{"i": ["cuda -model=1080", "topi_nn_conv2d", [["TENSOR", [32, 256, 28, 28], "int8"], ["TENSOR", [512, 256, 1, 1], "int8"], [1, 1], [0, 0], [1, 1], "NCHW", "int32"], {}, ["conv2d", [32, 256, 28, 28, "int8"], [512, 256, 1, 1, "int8"], [1, 1], [0, 0], [1, 1], "NCHW", "int32"], {"i": 983045526, "t": "int8", "c": null, "e": [["tile_n", "sp", [8, 2, 1, 2]], ["tile_f", "sp", [32, 1, 1, 4]], ["tile_y", "sp", [14, 1, 2, 1]], ["tile_x", "sp", [1, 1, 28, 1]], ["fuse_yx", "ot", 1], ["tile_rc", "sp", [8, 8]], ["tile_ry", "sp", [1, 1]], ["tile_rx", "sp", [1, 1]], ["AA_double_buffer", "ot", 0], ["WW_double_buffer", "ot", 1], ["auto_unroll_max_step", "ot", 512], ["reorder_inner", "re", [0, 1, 2]]]}], "r": [[0.0003544188], 0, 1.9183228015899658, 1541697761.642701], "v": 0.1}
{"i": ["cuda -model=1080", "topi_nn_conv2d", [["TENSOR", [32, 512, 28, 28], "int8"], ["TENSOR", [256, 512, 1, 1], "int8"], [1, 1], [0, 0], [1, 1], "NCHW", "int32"], {}, ["conv2d", [32, 512, 28, 28, "int8"], [256, 512, 1, 1, "int8"], [1, 1], [0, 0], [1, 1], "NCHW", "int32"], {"i": 545191304, "t": "int8", "c": null, "e": [["tile_n", "sp", [32, 1, 1, 1]], ["tile_f", "sp", [4, 1, 8, 2]], ["tile_y", "sp", [7, 2, 1, 2]], ["tile_x", "sp", [1, 1, 28, 1]], ["fuse_yx", "ot", 0], ["tile_rc", "sp", [8, 16]], ["tile_ry", "sp", [1, 1]], ["tile_rx", "sp", [1, 1]], ["AA_double_buffer", "ot", 0], ["WW_double_buffer", "ot", 0], ["auto_unroll_max_step", "ot", 512], ["reorder_inner", "re", [0, 1, 2]]]}], "r": [[0.0003234034], 0, 1.080552101135254, 1541701549.498244], "v": 0.1}
{"i": ["cuda -model=1080", "topi_nn_conv2d", [["TENSOR", [32, 512, 28, 28], "int8"], ["TENSOR", [512, 512, 1, 1], "int8"], [1, 1], [0, 0], [1, 1], "NCHW", "int32"], {}, ["conv2d", [32, 512, 28, 28, "int8"], [512, 512, 1, 1, "int8"], [1, 1], [0, 0], [1, 1], "NCHW", "int32"], {"i": 778730064, "t": "int8", "c": null, "e": [["tile_n", "sp", [32, 1, 1, 1]], ["tile_f", "sp", [8, 1, 8, 2]], ["tile_y", "sp", [7, 4, 1, 1]], ["tile_x", "sp", [1, 1, 28, 1]], ["fuse_yx", "ot", 0], ["tile_rc", "sp", [8, 16]], ["tile_ry", "sp", [1, 1]], ["tile_rx", "sp", [1, 1]], ["AA_double_buffer", "ot", 0], ["WW_double_buffer", "ot", 0], ["auto_unroll_max_step", "ot", 512], ["reorder_inner", "re", [0, 1, 2]]]}], "r": [[0.0006392654], 0, 1.048793077468872, 1541705360.653555], "v": 0.1}
{"i": ["cuda -model=1080", "topi_nn_conv2d", [["TENSOR", [32, 512, 14, 14], "int8"], ["TENSOR", [1024, 512, 1, 1], "int8"], [1, 1], [0, 0], [1, 1], "NCHW", "int32"], {}, ["conv2d", [32, 512, 14, 14, "int8"], [1024, 512, 1, 1, "int8"], [1, 1], [0, 0], [1, 1], "NCHW", "int32"], {"i": 169169652, "t": "int8", "c": null, "e": [["tile_n", "sp", [8, 1, 1, 4]], ["tile_f", "sp", [16, 1, 8, 2]], ["tile_y", "sp", [7, 1, 2, 1]], ["tile_x", "sp", [1, 1, 14, 1]], ["fuse_yx", "ot", 1], ["tile_rc", "sp", [16, 8]], ["tile_ry", "sp", [1, 1]], ["tile_rx", "sp", [1, 1]], ["AA_double_buffer", "ot", 0], ["WW_double_buffer", "ot", 0], ["auto_unroll_max_step", "ot", 512], ["reorder_inner", "re", [0, 1, 2]]]}], "r": [[0.0003282972], 0, 0.976830005645752, 1541716513.644884], "v": 0.1}
{"i": ["cuda -model=1080", "topi_nn_conv2d", [["TENSOR", [32, 1024, 14, 14], "int8"], ["TENSOR", [512, 1024, 1, 1], "int8"], [1, 1], [0, 0], [1, 1], "NCHW", "int32"], {}, ["conv2d", [32, 1024, 14, 14, "int8"], [512, 1024, 1, 1, "int8"], [1, 1], [0, 0], [1, 1], "NCHW", "int32"], {"i": 229692352, "t": "int8", "c": null, "e": [["tile_n", "sp", [4, 4, 2, 1]], ["tile_f", "sp", [16, 1, 4, 2]], ["tile_y", "sp", [7, 1, 2, 1]], ["tile_x", "sp", [1, 1, 14, 1]], ["fuse_yx", "ot", 1], ["tile_rc", "sp", [32, 8]], ["tile_ry", "sp", [1, 1]], ["tile_rx", "sp", [1, 1]], ["AA_double_buffer", "ot", 1], ["WW_double_buffer", "ot", 1], ["auto_unroll_max_step", "ot", 512], ["reorder_inner", "re", [0, 1, 2]]]}], "r": [[0.0003216457], 0, 1.2310090065002441, 1541721921.877186], "v": 0.1}
{"i": ["cuda -model=1080", "topi_nn_conv2d", [["TENSOR", [32, 1024, 14, 14], "int8"], ["TENSOR", [1024, 1024, 1, 1], "int8"], [1, 1], [0, 0], [1, 1], "NCHW", "int32"], {}, ["conv2d", [32, 1024, 14, 14, "int8"], [1024, 1024, 1, 1, "int8"], [1, 1], [0, 0], [1, 1], "NCHW", "int32"], {"i": 315826898, "t": "int8", "c": null, "e": [["tile_n", "sp", [8, 4, 1, 1]], ["tile_f", "sp", [16, 1, 8, 2]], ["tile_y", "sp", [7, 1, 2, 1]], ["tile_x", "sp", [1, 1, 14, 1]], ["fuse_yx", "ot", 1], ["tile_rc", "sp", [32, 8]], ["tile_ry", "sp", [1, 1]], ["tile_rx", "sp", [1, 1]], ["AA_double_buffer", "ot", 1], ["WW_double_buffer", "ot", 1], ["auto_unroll_max_step", "ot", 512], ["reorder_inner", "re", [0, 1, 2]]]}], "r": [[0.0006394333999999999], 0, 1.1346609592437744, 1541725403.342671], "v": 0.1}
{"i": ["cuda -model=1080", "topi_nn_conv2d", [["TENSOR", [32, 1024, 14, 14], "int8"], ["TENSOR", [2048, 1024, 1, 1], "int8"], [2, 2], [0, 0], [1, 1], "NCHW", "int32"], {}, ["conv2d", [32, 1024, 14, 14, "int8"], [2048, 1024, 1, 1, "int8"], [2, 2], [0, 0], [1, 1], "NCHW", "int32"], {"i": 39919063, "t": "int8", "c": null, "e": [["tile_n", "sp", [4, 4, 1, 2]], ["tile_f", "sp", [16, 1, 32, 1]], ["tile_y", "sp", [7, 1, 1, 1]], ["tile_x", "sp", [1, 1, 7, 1]], ["fuse_yx", "ot", 0], ["tile_rc", "sp", [64, 4]], ["tile_ry", "sp", [1, 1]], ["tile_rx", "sp", [1, 1]], ["AA_double_buffer", "ot", 1], ["WW_double_buffer", "ot", 1], ["auto_unroll_max_step", "ot", 1500], ["reorder_inner", "re", [0, 1, 2]]]}], "r": [[0.00045896870000000005], 0, 1.0030760765075684, 1541730930.123339], "v": 0.1}
{"i": ["cuda -model=1080", "topi_nn_conv2d", [["TENSOR", [32, 1024, 7, 7], "int8"], ["TENSOR", [2048, 1024, 1, 1], "int8"], [1, 1], [0, 0], [1, 1], "NCHW", "int32"], {}, ["conv2d", [32, 1024, 7, 7, "int8"], [2048, 1024, 1, 1, "int8"], [1, 1], [0, 0], [1, 1], "NCHW", "int32"], {"i": 25725765, "t": "int8", "c": null, "e": [["tile_n", "sp", [4, 2, 1, 4]], ["tile_f", "sp", [32, 2, 8, 1]], ["tile_y", "sp", [7, 1, 1, 1]], ["tile_x", "sp", [1, 1, 7, 1]], ["fuse_yx", "ot", 0], ["tile_rc", "sp", [64, 4]], ["tile_ry", "sp", [1, 1]], ["tile_rx", "sp", [1, 1]], ["AA_double_buffer", "ot", 1], ["WW_double_buffer", "ot", 1], ["auto_unroll_max_step", "ot", 512], ["reorder_inner", "re", [0, 1, 2]]]}], "r": [[0.00039937569999999996], 0, 1.2664740085601807, 1541738082.971998], "v": 0.1}
{"i": ["cuda -model=1080", "topi_nn_conv2d", [["TENSOR", [32, 2048, 7, 7], "int8"], ["TENSOR", [1024, 2048, 1, 1], "int8"], [1, 1], [0, 0], [1, 1], "NCHW", "int32"], {}, ["conv2d", [32, 2048, 7, 7, "int8"], [1024, 2048, 1, 1, "int8"], [1, 1], [0, 0], [1, 1], "NCHW", "int32"], {"i": 33634617, "t": "int8", "c": null, "e": [["tile_n", "sp", [2, 8, 2, 1]], ["tile_f", "sp", [32, 2, 4, 1]], ["tile_y", "sp", [7, 1, 1, 1]], ["tile_x", "sp", [1, 1, 7, 1]], ["fuse_yx", "ot", 1], ["tile_rc", "sp", [64, 8]], ["tile_ry", "sp", [1, 1]], ["tile_rx", "sp", [1, 1]], ["AA_double_buffer", "ot", 1], ["WW_double_buffer", "ot", 1], ["auto_unroll_max_step", "ot", 1500], ["reorder_inner", "re", [0, 1, 2]]]}], "r": [[0.0004020331], 0, 1.6853482723236084, 1541743794.471081], "v": 0.1}
{"i": ["cuda -model=1080", "topi_nn_conv2d", [["TENSOR", [1, 16, 224, 224], "int8"], ["TENSOR", [16, 16, 3, 3], "int8"], [1, 1], [1, 1], [1, 1], "NCHW", "int32"], {}, ["conv2d", [1, 16, 224, 224, "int8"], [16, 16, 3, 3, "int8"], [1, 1], [1, 1], [1, 1], "NCHW", "int32"], {"i": 87931228, "t": "int8", "c": null, "e": [["tile_n", "sp", [1, 1, 1, 1]], ["tile_f", "sp", [1, 1, 2, 2]], ["tile_y", "sp", [56, 4, 1, 1]], ["tile_x", "sp", [7, 1, 32, 1]], ["fuse_yx", "ot", 1], ["tile_rc", "sp", [4, 1]], ["tile_ry", "sp", [1, 3]], ["tile_rx", "sp", [3, 1]], ["AA_double_buffer", "ot", 1], ["WW_double_buffer", "ot", 1], ["auto_unroll_max_step", "ot", 512], ["reorder_inner", "re", [0, 1, 2]]]}], "r": [[1.48205e-05], 0, 1.2778558731079102, 1541756002.365224], "v": 0.1}
{"i": ["cuda -model=1080", "topi_nn_conv2d", [["TENSOR", [1, 16, 224, 224], "int8"], ["TENSOR", [32, 16, 3, 3], "int8"], [2, 2], [1, 1], [1, 1], "NCHW", "int32"], {}, ["conv2d", [1, 16, 224, 224, "int8"], [32, 16, 3, 3, "int8"], [2, 2], [1, 1], [1, 1], "NCHW", "int32"], {"i": 111824788, "t": "int8", "c": null, "e": [["tile_n", "sp", [1, 1, 1, 1]], ["tile_f", "sp", [1, 2, 4, 1]], ["tile_y", "sp", [14, 1, 4, 2]], ["tile_x", "sp", [7, 1, 16, 1]], ["fuse_yx", "ot", 1], ["tile_rc", "sp", [2, 2]], ["tile_ry", "sp", [1, 3]], ["tile_rx", "sp", [1, 3]], ["AA_double_buffer", "ot", 1], ["WW_double_buffer", "ot", 1], ["auto_unroll_max_step", "ot", 1500], ["reorder_inner", "re", [0, 1, 2]]]}], "r": [[1.64178e-05], 0, 1.2168512344360352, 1541767025.786315], "v": 0.1}
{"i": ["cuda -model=1080", "topi_nn_conv2d", [["TENSOR", [1, 16, 224, 224], "int8"], ["TENSOR", [32, 16, 1, 1], "int8"], [2, 2], [0, 0], [1, 1], "NCHW", "int32"], {}, ["conv2d", [1, 16, 224, 224, "int8"], [32, 16, 1, 1, "int8"], [2, 2], [0, 0], [1, 1], "NCHW", "int32"], {"i": 907206, "t": "int8", "c": null, "e": [["tile_n", "sp", [1, 1, 1, 1]], ["tile_f", "sp", [1, 4, 2, 1]], ["tile_y", "sp", [112, 1, 1, 1]], ["tile_x", "sp", [1, 1, 112, 1]], ["fuse_yx", "ot", 0], ["tile_rc", "sp", [2, 2]], ["tile_ry", "sp", [1, 1]], ["tile_rx", "sp", [1, 1]], ["AA_double_buffer", "ot", 0], ["WW_double_buffer", "ot", 0], ["auto_unroll_max_step", "ot", 0], ["reorder_inner", "re", [0, 1, 2]]]}], "r": [[6.324300000000001e-06], 0, 0.8963007926940918, 1541772626.090226], "v": 0.1}
{"i": ["cuda -model=1080", "topi_nn_conv2d", [["TENSOR", [1, 32, 112, 112], "int8"], ["TENSOR", [32, 32, 3, 3], "int8"], [1, 1], [1, 1], [1, 1], "NCHW", "int32"], {}, ["conv2d", [1, 32, 112, 112, "int8"], [32, 32, 3, 3, "int8"], [1, 1], [1, 1], [1, 1], "NCHW", "int32"], {"i": 142009569, "t": "int8", "c": null, "e": [["tile_n", "sp", [1, 1, 1, 1]], ["tile_f", "sp", [1, 1, 8, 1]], ["tile_y", "sp", [8, 1, 2, 7]], ["tile_x", "sp", [7, 1, 16, 1]], ["fuse_yx", "ot", 0], ["tile_rc", "sp", [4, 2]], ["tile_ry", "sp", [1, 3]], ["tile_rx", "sp", [3, 1]], ["AA_double_buffer", "ot", 1], ["WW_double_buffer", "ot", 1], ["auto_unroll_max_step", "ot", 1500], ["reorder_inner", "re", [0, 1, 2]]]}], "r": [[1.4175200000000001e-05], 0, 1.158653974533081, 1541779819.064271], "v": 0.1}
{"i": ["cuda -model=1080", "topi_nn_conv2d", [["TENSOR", [1, 32, 112, 112], "int8"], ["TENSOR", [64, 32, 1, 1], "int8"], [2, 2], [0, 0], [1, 1], "NCHW", "int32"], {}, ["conv2d", [1, 32, 112, 112, "int8"], [64, 32, 1, 1, "int8"], [2, 2], [0, 0], [1, 1], "NCHW", "int32"], {"i": 753217, "t": "int8", "c": null, "e": [["tile_n", "sp", [1, 1, 1, 1]], ["tile_f", "sp", [2, 4, 1, 2]], ["tile_y", "sp", [56, 1, 1, 1]], ["tile_x", "sp", [1, 1, 56, 1]], ["fuse_yx", "ot", 1], ["tile_rc", "sp", [4, 2]], ["tile_ry", "sp", [1, 1]], ["tile_rx", "sp", [1, 1]], ["AA_double_buffer", "ot", 0], ["WW_double_buffer", "ot", 0], ["auto_unroll_max_step", "ot", 0], ["reorder_inner", "re", [0, 1, 2]]]}], "r": [[5.2656e-06], 0, 0.8688280582427979, 1541795517.973982], "v": 0.1}
{"i": ["cuda -model=1080", "topi_nn_conv2d", [["TENSOR", [1, 128, 28, 28], "int8"], ["TENSOR", [256, 128, 1, 1], "int8"], [1, 1], [0, 0], [1, 1], "NCHW", "int32"], {}, ["conv2d", [1, 128, 28, 28, "int8"], [256, 128, 1, 1, "int8"], [1, 1], [0, 0], [1, 1], "NCHW", "int32"], {"i": 7718547, "t": "int8", "c": null, "e": [["tile_n", "sp", [1, 1, 1, 1]], ["tile_f", "sp", [8, 1, 4, 2]], ["tile_y", "sp", [7, 2, 2, 1]], ["tile_x", "sp", [1, 1, 28, 1]], ["fuse_yx", "ot", 1], ["tile_rc", "sp", [2, 16]], ["tile_ry", "sp", [1, 1]], ["tile_rx", "sp", [1, 1]], ["AA_double_buffer", "ot", 0], ["WW_double_buffer", "ot", 0], ["auto_unroll_max_step", "ot", 512], ["reorder_inner", "re", [0, 1, 2]]]}], "r": [[7.5438000000000005e-06], 0, 1.0039641857147217, 1541818592.303096], "v": 0.1}
{"i": ["cuda -model=1080", "topi_nn_conv2d", [["TENSOR", [1, 256, 28, 28], "int8"], ["TENSOR", [512, 256, 1, 1], "int8"], [1, 1], [0, 0], [1, 1], "NCHW", "int32"], {}, ["conv2d", [1, 256, 28, 28, "int8"], [512, 256, 1, 1, "int8"], [1, 1], [0, 0], [1, 1], "NCHW", "int32"], {"i": 22737862, "t": "int8", "c": null, "e": [["tile_n", "sp", [1, 1, 1, 1]], ["tile_f", "sp", [8, 2, 8, 1]], ["tile_y", "sp", [7, 4, 1, 1]], ["tile_x", "sp", [1, 1, 28, 1]], ["fuse_yx", "ot", 0], ["tile_rc", "sp", [8, 8]], ["tile_ry", "sp", [1, 1]], ["tile_rx", "sp", [1, 1]], ["AA_double_buffer", "ot", 0], ["WW_double_buffer", "ot", 0], ["auto_unroll_max_step", "ot", 1500], ["reorder_inner", "re", [0, 1, 2]]]}], "r": [[1.68021e-05], 0, 0.9901399612426758, 1541838814.847703], "v": 0.1}
{"i": ["cuda -model=1080", "topi_nn_conv2d", [["TENSOR", [32, 16, 224, 224], "int8"], ["TENSOR", [16, 16, 3, 3], "int8"], [1, 1], [1, 1], [1, 1], "NCHW", "int32"], {}, ["conv2d", [32, 16, 224, 224, "int8"], [16, 16, 3, 3, "int8"], [1, 1], [1, 1], [1, 1], "NCHW", "int32"], {"i": 4924208464, "t": "int8", "c": null, "e": [["tile_n", "sp", [32, 1, 1, 1]], ["tile_f", "sp", [1, 2, 2, 1]], ["tile_y", "sp", [28, 2, 1, 4]], ["tile_x", "sp", [7, 1, 32, 1]], ["fuse_yx", "ot", 1], ["tile_rc", "sp", [4, 1]], ["tile_ry", "sp", [1, 3]], ["tile_rx", "sp", [3, 1]], ["AA_double_buffer", "ot", 1], ["WW_double_buffer", "ot", 1], ["auto_unroll_max_step", "ot", 512], ["reorder_inner", "re", [0, 1, 2]]]}], "r": [[0.00039125490000000004], 0, 1.3024868965148926, 1541861092.851224], "v": 0.1}
{"i": ["cuda -model=1080", "topi_nn_conv2d", [["TENSOR", [32, 16, 224, 224], "int8"], ["TENSOR", [32, 16, 3, 3], "int8"], [2, 2], [1, 1], [1, 1], "NCHW", "int32"], {}, ["conv2d", [32, 16, 224, 224, "int8"], [32, 16, 3, 3, "int8"], [2, 2], [1, 1], [1, 1], "NCHW", "int32"], {"i": 4132800504, "t": "int8", "c": null, "e": [["tile_n", "sp", [32, 1, 1, 1]], ["tile_f", "sp", [1, 1, 8, 1]], ["tile_y", "sp", [7, 4, 4, 1]], ["tile_x", "sp", [7, 1, 16, 1]], ["fuse_yx", "ot", 0], ["tile_rc", "sp", [2, 2]], ["tile_ry", "sp", [1, 3]], ["tile_rx", "sp", [1, 3]], ["AA_double_buffer", "ot", 1], ["WW_double_buffer", "ot", 1], ["auto_unroll_max_step", "ot", 512], ["reorder_inner", "re", [0, 1, 2]]]}], "r": [[0.0003926324], 0, 1.4657158851623535, 1541873031.25497], "v": 0.1}
{"i": ["cuda -model=1080", "topi_nn_conv2d", [["TENSOR", [32, 16, 224, 224], "int8"], ["TENSOR", [32, 16, 1, 1], "int8"], [2, 2], [0, 0], [1, 1], "NCHW", "int32"], {}, ["conv2d", [32, 16, 224, 224, "int8"], [32, 16, 1, 1, "int8"], [2, 2], [0, 0], [1, 1], "NCHW", "int32"], {"i": 50803368, "t": "int8", "c": null, "e": [["tile_n", "sp", [32, 1, 1, 1]], ["tile_f", "sp", [1, 8, 1, 1]], ["tile_y", "sp", [112, 1, 1, 1]], ["tile_x", "sp", [1, 1, 112, 1]], ["fuse_yx", "ot", 0], ["tile_rc", "sp", [2, 2]], ["tile_ry", "sp", [1, 1]], ["tile_rx", "sp", [1, 1]], ["AA_double_buffer", "ot", 0], ["WW_double_buffer", "ot", 0], ["auto_unroll_max_step", "ot", 0], ["reorder_inner", "re", [0, 1, 2]]]}], "r": [[0.0001192816], 0, 0.8604419231414795, 1541878431.618475], "v": 0.1}
{"i": ["cuda -model=1080", "topi_nn_conv2d", [["TENSOR", [32, 32, 112, 112], "int8"], ["TENSOR", [64, 32, 3, 3], "int8"], [2, 2], [1, 1], [1, 1], "NCHW", "int32"], {}, ["conv2d", [32, 32, 112, 112, "int8"], [64, 32, 3, 3, "int8"], [2, 2], [1, 1], [1, 1], "NCHW", "int32"], {"i": 3115462454, "t": "int8", "c": null, "e": [["tile_n", "sp", [16, 1, 2, 1]], ["tile_f", "sp", [1, 2, 4, 2]], ["tile_y", "sp", [28, 2, 1, 1]], ["tile_x", "sp", [1, 1, 56, 1]], ["fuse_yx", "ot", 0], ["tile_rc", "sp", [8, 1]], ["tile_ry", "sp", [1, 3]], ["tile_rx", "sp", [1, 3]], ["AA_double_buffer", "ot", 1], ["WW_double_buffer", "ot", 1], ["auto_unroll_max_step", "ot", 512], ["reorder_inner", "re", [0, 1, 2]]]}], "r": [[0.0003346137], 0, 1.3491690158843994, 1541896942.447926], "v": 0.1}
{"i": ["cuda -model=1080", "topi_nn_conv2d", [["TENSOR", [32, 32, 112, 112], "int8"], ["TENSOR", [64, 32, 1, 1], "int8"], [2, 2], [0, 0], [1, 1], "NCHW", "int32"], {}, ["conv2d", [32, 32, 112, 112, "int8"], [64, 32, 1, 1, "int8"], [2, 2], [0, 0], [1, 1], "NCHW", "int32"], {"i": 29636936, "t": "int8", "c": null, "e": [["tile_n", "sp", [32, 1, 1, 1]], ["tile_f", "sp", [2, 1, 1, 8]], ["tile_y", "sp", [56, 1, 1, 1]], ["tile_x", "sp", [1, 1, 56, 1]], ["fuse_yx", "ot", 0], ["tile_rc", "sp", [4, 2]], ["tile_ry", "sp", [1, 1]], ["tile_rx", "sp", [1, 1]], ["AA_double_buffer", "ot", 0], ["WW_double_buffer", "ot", 0], ["auto_unroll_max_step", "ot", 0], ["reorder_inner", "re", [0, 1, 2]]]}], "r": [[7.66827e-05], 0, 0.9455158710479736, 1541906810.582079], "v": 0.1}
{"i": ["cuda -model=1080", "topi_nn_conv2d", [["TENSOR", [32, 64, 56, 56], "int8"], ["TENSOR", [128, 64, 1, 1], "int8"], [2, 2], [0, 0], [1, 1], "NCHW", "int32"], {}, ["conv2d", [32, 64, 56, 56, "int8"], [128, 64, 1, 1, "int8"], [2, 2], [0, 0], [1, 1], "NCHW", "int32"], {"i": 22203833, "t": "int8", "c": null, "e": [["tile_n", "sp", [16, 2, 1, 1]], ["tile_f", "sp", [1, 4, 8, 1]], ["tile_y", "sp", [28, 1, 1, 1]], ["tile_x", "sp", [1, 1, 28, 1]], ["fuse_yx", "ot", 0], ["tile_rc", "sp", [4, 4]], ["tile_ry", "sp", [1, 1]], ["tile_rx", "sp", [1, 1]], ["AA_double_buffer", "ot", 0], ["WW_double_buffer", "ot", 0], ["auto_unroll_max_step", "ot", 0], ["reorder_inner", "re", [0, 1, 2]]]}], "r": [[6.13521e-05], 0, 0.9886660575866699, 1541923990.176507], "v": 0.1}
{"i": ["cuda -model=1080", "topi_nn_conv2d", [["TENSOR", [32, 128, 28, 28], "int8"], ["TENSOR", [256, 128, 3, 3], "int8"], [1, 1], [2, 2], [2, 2], "NCHW", "int32"], {}, ["conv2d", [32, 128, 28, 28, "int8"], [256, 128, 3, 3, "int8"], [1, 1], [2, 2], [2, 2], "NCHW", "int32"], {"i": 4081357448, "t": "int8", "c": null, "e": [["tile_n", "sp", [32, 1, 1, 1]], ["tile_f", "sp", [4, 1, 8, 2]], ["tile_y", "sp", [1, 1, 4, 7]], ["tile_x", "sp", [7, 1, 4, 1]], ["fuse_yx", "ot", 0], ["tile_rc", "sp", [16, 2]], ["tile_ry", "sp", [1, 3]], ["tile_rx", "sp", [3, 1]], ["AA_double_buffer", "ot", 1], ["WW_double_buffer", "ot", 1], ["auto_unroll_max_step", "ot", 1500], ["reorder_inner", "re", [0, 1, 2]]]}], "r": [[0.0005570524000000001], 0, 1.5599451065063477, 1541928552.867772], "v": 0.1}
{"i": ["cuda -model=1080", "topi_nn_conv2d", [["TENSOR", [32, 128, 28, 28], "int8"], ["TENSOR", [256, 128, 1, 1], "int8"], [1, 1], [0, 0], [1, 1], "NCHW", "int32"], {}, ["conv2d", [32, 128, 28, 28, "int8"], [256, 128, 1, 1, "int8"], [1, 1], [0, 0], [1, 1], "NCHW", "int32"], {"i": 311829806, "t": "int8", "c": null, "e": [["tile_n", "sp", [8, 2, 1, 2]], ["tile_f", "sp", [16, 2, 1, 2]], ["tile_y", "sp", [7, 1, 4, 1]], ["tile_x", "sp", [1, 1, 28, 1]], ["fuse_yx", "ot", 1], ["tile_rc", "sp", [8, 4]], ["tile_ry", "sp", [1, 1]], ["tile_rx", "sp", [1, 1]], ["AA_double_buffer", "ot", 1], ["WW_double_buffer", "ot", 1], ["auto_unroll_max_step", "ot", 0], ["reorder_inner", "re", [0, 1, 2]]]}], "r": [[9.99139e-05], 0, 1.0698919296264648, 1541935144.954517], "v": 0.1}
{"i": ["cuda -model=1080", "topi_nn_conv2d", [["TENSOR", [32, 256, 28, 28], "int8"], ["TENSOR", [256, 256, 3, 3], "int8"], [1, 1], [2, 2], [2, 2], "NCHW", "int32"], {}, ["conv2d", [32, 256, 28, 28, "int8"], [256, 256, 3, 3, "int8"], [1, 1], [2, 2], [2, 2], "NCHW", "int32"], {"i": 3065254498, "t": "int8", "c": null, "e": [["tile_n", "sp", [8, 1, 2, 2]], ["tile_f", "sp", [4, 2, 8, 1]], ["tile_y", "sp", [7, 1, 1, 4]], ["tile_x", "sp", [7, 1, 4, 1]], ["fuse_yx", "ot", 1], ["tile_rc", "sp", [64, 1]], ["tile_ry", "sp", [1, 3]], ["tile_rx", "sp", [3, 1]], ["AA_double_buffer", "ot", 1], ["WW_double_buffer", "ot", 1], ["auto_unroll_max_step", "ot", 512], ["reorder_inner", "re", [0, 1, 2]]]}], "r": [[0.0009923536999999999], 0, 1.1360900402069092, 1541941901.093814], "v": 0.1}
{"i": ["cuda -model=1080", "topi_nn_conv2d", [["TENSOR", [32, 512, 28, 28], "int8"], ["TENSOR", [512, 512, 3, 3], "int8"], [1, 1], [4, 4], [4, 4], "NCHW", "int32"], {}, ["conv2d", [32, 512, 28, 28, "int8"], [512, 512, 3, 3, "int8"], [1, 1], [4, 4], [4, 4], "NCHW", "int32"], {"i": 7604420469, "t": "int8", "c": null, "e": [["tile_n", "sp", [4, 2, 1, 4]], ["tile_f", "sp", [8, 2, 8, 1]], ["tile_y", "sp", [7, 1, 4, 1]], ["tile_x", "sp", [7, 1, 4, 1]], ["fuse_yx", "ot", 1], ["tile_rc", "sp", [64, 2]], ["tile_ry", "sp", [3, 1]], ["tile_rx", "sp", [3, 1]], ["AA_double_buffer", "ot", 1], ["WW_double_buffer", "ot", 1], ["auto_unroll_max_step", "ot", 1500], ["reorder_inner", "re", [0, 1, 2]]]}], "r": [[0.0042585177000000005], 0, 1.711007833480835, 1541965321.557229], "v": 0.1}
{"i": ["cuda -model=1080", "topi_nn_conv2d", [["TENSOR", [32, 512, 28, 28], "int8"], ["TENSOR", [512, 512, 3, 3], "int8"], [1, 1], [2, 2], [2, 2], "NCHW", "int32"], {}, ["conv2d", [32, 512, 28, 28, "int8"], [512, 512, 3, 3, "int8"], [1, 1], [2, 2], [2, 2], "NCHW", "int32"], {"i": 4991664554, "t": "int8", "c": null, "e": [["tile_n", "sp", [8, 4, 1, 1]], ["tile_f", "sp", [4, 2, 16, 1]], ["tile_y", "sp", [7, 2, 2, 1]], ["tile_x", "sp", [7, 1, 4, 1]], ["fuse_yx", "ot", 0], ["tile_rc", "sp", [128, 1]], ["tile_ry", "sp", [1, 3]], ["tile_rx", "sp", [3, 1]], ["AA_double_buffer", "ot", 1], ["WW_double_buffer", "ot", 1], ["auto_unroll_max_step", "ot", 512], ["reorder_inner", "re", [0, 1, 2]]]}], "r": [[0.0038065215], 0, 1.4341950416564941, 1541973546.028996], "v": 0.1}
{"i": ["cuda -model=1080", "topi_nn_conv2d", [["TENSOR", [1, 64, 56, 56], "int8"], ["TENSOR", [128, 64, 1, 1], "int8"], [2, 2], [0, 0], [1, 1], "NCHW", "int32"], {}, ["conv2d", [1, 64, 56, 56, "int8"], [128, 64, 1, 1, "int8"], [2, 2], [0, 0], [1, 1], "NCHW", "int32"], {"i": 486088, "t": "int8", "c": null, "e": [["tile_n", "sp", [1, 1, 1, 1]], ["tile_f", "sp", [4, 4, 2, 1]], ["tile_y", "sp", [28, 1, 1, 1]], ["tile_x", "sp", [1, 1, 28, 1]], ["fuse_yx", "ot", 1], ["tile_rc", "sp", [4, 4]], ["tile_ry", "sp", [1, 1]], ["tile_rx", "sp", [1, 1]], ["AA_double_buffer", "ot", 0], ["WW_double_buffer", "ot", 0], ["auto_unroll_max_step", "ot", 0], ["reorder_inner", "re", [0, 1, 2]]]}], "r": [[5.0906e-06], 0, 0.8725800514221191, 1542043190.444661], "v": 0.1}
{"i": ["cuda -model=1080", "topi_nn_conv2d", [["TENSOR", [1, 256, 28, 28], "int8"], ["TENSOR", [512, 256, 3, 3], "int8"], [1, 1], [4, 4], [4, 4], "NCHW", "int32"], {}, ["conv2d", [1, 256, 28, 28, "int8"], [512, 256, 3, 3, "int8"], [1, 1], [4, 4], [4, 4], "NCHW", "int32"], {"i": 66321889, "t": "int8", "c": null, "e": [["tile_n", "sp", [1, 1, 1, 1]], ["tile_f", "sp", [16, 1, 4, 2]], ["tile_y", "sp", [7, 4, 1, 1]], ["tile_x", "sp", [1, 1, 28, 1]], ["fuse_yx", "ot", 1], ["tile_rc", "sp", [4, 16]], ["tile_ry", "sp", [3, 1]], ["tile_rx", "sp", [3, 1]], ["AA_double_buffer", "ot", 0], ["WW_double_buffer", "ot", 1], ["auto_unroll_max_step", "ot", 512], ["reorder_inner", "re", [0, 1, 2]]]}], "r": [[0.0001022937], 0, 1.989537000656128, 1542072474.603873], "v": 0.1}
{"i": ["cuda -model=1080", "topi_nn_conv2d", [["TENSOR", [1, 512, 28, 28], "int8"], ["TENSOR", [512, 512, 3, 3], "int8"], [1, 1], [2, 2], [2, 2], "NCHW", "int32"], {}, ["conv2d", [1, 512, 28, 28, "int8"], [512, 512, 3, 3, "int8"], [1, 1], [2, 2], [2, 2], "NCHW", "int32"], {"i": 95668254, "t": "int8", "c": null, "e": [["tile_n", "sp", [1, 1, 1, 1]], ["tile_f", "sp", [8, 1, 8, 2]], ["tile_y", "sp", [1, 1, 4, 7]], ["tile_x", "sp", [7, 1, 4, 1]], ["fuse_yx", "ot", 0], ["tile_rc", "sp", [64, 2]], ["tile_ry", "sp", [1, 3]], ["tile_rx", "sp", [1, 3]], ["AA_double_buffer", "ot", 1], ["WW_double_buffer", "ot", 1], ["auto_unroll_max_step", "ot", 512], ["reorder_inner", "re", [0, 1, 2]]]}], "r": [[0.0001487455], 0, 1.871932029724121, 1542092677.174727], "v": 0.1}
{"i": ["cuda -model=1080", "topi_nn_conv2d", [["TENSOR", [32, 32, 112, 112], "int8"], ["TENSOR", [32, 32, 3, 3], "int8"], [1, 1], [1, 1], [1, 1], "NCHW", "int32"], {}, ["conv2d", [32, 32, 112, 112, "int8"], [32, 32, 3, 3, "int8"], [1, 1], [1, 1], [1, 1], "NCHW", "int32"], {"i": 7930557936, "t": "int8", "c": null, "e": [["tile_n", "sp", [32, 1, 1, 1]], ["tile_f", "sp", [1, 4, 2, 1]], ["tile_y", "sp", [28, 1, 1, 4]], ["tile_x", "sp", [7, 1, 16, 1]], ["fuse_yx", "ot", 1], ["tile_rc", "sp", [8, 1]], ["tile_ry", "sp", [1, 3]], ["tile_rx", "sp", [3, 1]], ["AA_double_buffer", "ot", 1], ["WW_double_buffer", "ot", 1], ["auto_unroll_max_step", "ot", 1500], ["reorder_inner", "re", [0, 1, 2]]]}], "r": [[0.0002962054], 0, 1.3068499565124512, 1542116389.997942], "v": 0.1}
{"i": ["cuda -model=1080", "topi_nn_conv2d", [["TENSOR", [32, 64, 56, 56], "int8"], ["TENSOR", [128, 64, 3, 3], "int8"], [2, 2], [1, 1], [1, 1], "NCHW", "int32"], {}, ["conv2d", [32, 64, 56, 56, "int8"], [128, 64, 3, 3, "int8"], [2, 2], [1, 1], [1, 1], "NCHW", "int32"], {"i": 1556715504, "t": "int8", "c": null, "e": [["tile_n", "sp", [4, 4, 2, 1]], ["tile_f", "sp", [1, 1, 16, 2]], ["tile_y", "sp", [14, 2, 1, 1]], ["tile_x", "sp", [7, 1, 4, 1]], ["fuse_yx", "ot", 0], ["tile_rc", "sp", [16, 1]], ["tile_ry", "sp", [1, 3]], ["tile_rx", "sp", [1, 3]], ["AA_double_buffer", "ot", 1], ["WW_double_buffer", "ot", 1], ["auto_unroll_max_step", "ot", 512], ["reorder_inner", "re", [0, 1, 2]]]}], "r": [[0.00024314330000000002], 0, 1.29060697555542, 1542134648.796838], "v": 0.1}
{"i": ["cuda -model=1080", "topi_nn_conv2d", [["TENSOR", [32, 256, 28, 28], "int8"], ["TENSOR", [512, 256, 3, 3], "int8"], [1, 1], [4, 4], [4, 4], "NCHW", "int32"], {}, ["conv2d", [32, 256, 28, 28, "int8"], [512, 256, 3, 3, "int8"], [1, 1], [4, 4], [4, 4], "NCHW", "int32"], {"i": 6658304979, "t": "int8", "c": null, "e": [["tile_n", "sp", [8, 1, 4, 1]], ["tile_f", "sp", [4, 4, 8, 1]], ["tile_y", "sp", [7, 2, 1, 2]], ["tile_x", "sp", [7, 1, 4, 1]], ["fuse_yx", "ot", 1], ["tile_rc", "sp", [32, 2]], ["tile_ry", "sp", [3, 1]], ["tile_rx", "sp", [3, 1]], ["AA_double_buffer", "ot", 1], ["WW_double_buffer", "ot", 1], ["auto_unroll_max_step", "ot", 1500], ["reorder_inner", "re", [0, 1, 2]]]}], "r": [[0.002208995], 0, 2.0039169788360596, 1542167922.79984], "v": 0.1}
{"i": ["cuda -model=1080", "topi_nn_conv2d", [["TENSOR", [32, 3, 224, 224], "int8"], ["TENSOR", [64, 3, 7, 7], "int8"], [2, 2], [3, 3], [1, 1], "NCHW", "int32"], {}, ["conv2d", [32, 3, 224, 224, "int8"], [64, 3, 7, 7, "int8"], [2, 2], [3, 3], [1, 1], "NCHW", "int32"], {"i": 76435065, "t": "direct", "c": null, "e": [["tile_f", "sp", [1, 8, 8, 1]], ["tile_y", "sp", [14, 1, 2, 4]], ["tile_x", "sp", [14, 1, 4, 2]], ["tile_rc", "sp", [3, 1]], ["tile_ry", "sp", [1, 7]], ["tile_rx", "sp", [1, 7]], ["auto_unroll_max_step", "ot", 1500], ["unroll_explicit", "ot", 1], ["reorder_inner", "re", [0, 1, 2]]]}], "r": [[0.0010388062], 0, 1.8500139713287354, 1542258653.100541], "v": 0.1}
{"i": ["cuda -model=1080", "topi_nn_conv2d", [["TENSOR", [32, 64, 56, 56], "int8"], ["TENSOR", [64, 64, 1, 1], "int8"], [1, 1], [0, 0], [1, 1], "NCHW", "int32"], {}, ["conv2d", [32, 64, 56, 56, "int8"], [64, 64, 1, 1, "int8"], [1, 1], [0, 0], [1, 1], "NCHW", "int32"], {"i": 67295537, "t": "int8", "c": null, "e": [["tile_n", "sp", [16, 2, 1, 1]], ["tile_f", "sp", [4, 2, 1, 2]], ["tile_y", "sp", [14, 1, 4, 1]], ["tile_x", "sp", [1, 1, 56, 1]], ["fuse_yx", "ot", 1], ["tile_rc", "sp", [4, 4]], ["tile_ry", "sp", [1, 1]], ["tile_rx", "sp", [1, 1]], ["AA_double_buffer", "ot", 0], ["WW_double_buffer", "ot", 0], ["auto_unroll_max_step", "ot", 0], ["reorder_inner", "re", [0, 1, 2]]]}], "r": [[7.63689e-05], 0, 0.8498458862304688, 1542273946.144296], "v": 0.1}
{"i": ["cuda -model=1080", "topi_nn_conv2d", [["TENSOR", [32, 64, 56, 56], "int8"], ["TENSOR", [64, 64, 3, 3], "int8"], [1, 1], [1, 1], [1, 1], "NCHW", "int32"], {}, ["conv2d", [32, 64, 56, 56, "int8"], [64, 64, 3, 3, "int8"], [1, 1], [1, 1], [1, 1], "NCHW", "int32"], {"i": 5648369853, "t": "int8", "c": null, "e": [["tile_n", "sp", [16, 1, 1, 2]], ["tile_f", "sp", [2, 1, 8, 1]], ["tile_y", "sp", [4, 1, 2, 7]], ["tile_x", "sp", [7, 1, 8, 1]], ["fuse_yx", "ot", 0], ["tile_rc", "sp", [16, 1]], ["tile_ry", "sp", [1, 3]], ["tile_rx", "sp", [3, 1]], ["AA_double_buffer", "ot", 1], ["WW_double_buffer", "ot", 1], ["auto_unroll_max_step", "ot", 1500], ["reorder_inner", "re", [0, 1, 2]]]}], "r": [[0.0003185045], 0, 1.2409718036651611, 1542282329.356736], "v": 0.1}
{"i": ["cuda -model=1080", "topi_nn_conv2d", [["TENSOR", [32, 256, 56, 56], "int8"], ["TENSOR", [64, 256, 1, 1], "int8"], [1, 1], [0, 0], [1, 1], "NCHW", "int32"], {}, ["conv2d", [32, 256, 56, 56, "int8"], [64, 256, 1, 1, "int8"], [1, 1], [0, 0], [1, 1], "NCHW", "int32"], {"i": 2024135680, "t": "int8", "c": null, "e": [["tile_n", "sp", [32, 1, 1, 1]], ["tile_f", "sp", [2, 2, 4, 1]], ["tile_y", "sp", [14, 4, 1, 1]], ["tile_x", "sp", [1, 1, 56, 1]], ["fuse_yx", "ot", 1], ["tile_rc", "sp", [8, 8]], ["tile_ry", "sp", [1, 1]], ["tile_rx", "sp", [1, 1]], ["AA_double_buffer", "ot", 1], ["WW_double_buffer", "ot", 1], ["auto_unroll_max_step", "ot", 1500], ["reorder_inner", "re", [0, 1, 2]]]}], "r": [[0.0001879648], 0, 1.2659311294555664, 1542292903.962012], "v": 0.1}
{"i": ["cuda -model=1080", "topi_nn_conv2d", [["TENSOR", [32, 256, 56, 56], "int8"], ["TENSOR", [128, 256, 1, 1], "int8"], [2, 2], [0, 0], [1, 1], "NCHW", "int32"], {}, ["conv2d", [32, 256, 56, 56, "int8"], [128, 256, 1, 1, "int8"], [2, 2], [0, 0], [1, 1], "NCHW", "int32"], {"i": 448699833, "t": "int8", "c": null, "e": [["tile_n", "sp", [16, 2, 1, 1]], ["tile_f", "sp", [1, 4, 8, 1]], ["tile_y", "sp", [28, 1, 1, 1]], ["tile_x", "sp", [1, 1, 28, 1]], ["fuse_yx", "ot", 1], ["tile_rc", "sp", [16, 4]], ["tile_ry", "sp", [1, 1]], ["tile_rx", "sp", [1, 1]], ["AA_double_buffer", "ot", 0], ["WW_double_buffer", "ot", 1], ["auto_unroll_max_step", "ot", 512], ["reorder_inner", "re", [0, 1, 2]]]}], "r": [[0.0001445967], 0, 1.1772758960723877, 1542298386.116408], "v": 0.1}
{"i": ["cuda -model=1080", "topi_nn_conv2d", [["TENSOR", [32, 128, 28, 28], "int8"], ["TENSOR", [128, 128, 3, 3], "int8"], [1, 1], [1, 1], [1, 1], "NCHW", "int32"], {}, ["conv2d", [32, 128, 28, 28, "int8"], [128, 128, 3, 3, "int8"], [1, 1], [1, 1], [1, 1], "NCHW", "int32"], {"i": 2715880335, "t": "int8", "c": null, "e": [["tile_n", "sp", [8, 2, 2, 1]], ["tile_f", "sp", [4, 1, 8, 1]], ["tile_y", "sp", [2, 1, 2, 7]], ["tile_x", "sp", [7, 1, 4, 1]], ["fuse_yx", "ot", 1], ["tile_rc", "sp", [32, 1]], ["tile_ry", "sp", [1, 3]], ["tile_rx", "sp", [3, 1]], ["AA_double_buffer", "ot", 1], ["WW_double_buffer", "ot", 1], ["auto_unroll_max_step", "ot", 1500], ["reorder_inner", "re", [0, 1, 2]]]}], "r": [[0.0003046728], 0, 1.3338449001312256, 1542303863.117098], "v": 0.1}
{"i": ["cuda -model=1080", "topi_nn_conv2d", [["TENSOR", [32, 128, 28, 28], "int8"], ["TENSOR", [512, 128, 1, 1], "int8"], [1, 1], [0, 0], [1, 1], "NCHW", "int32"], {}, ["conv2d", [32, 128, 28, 28, "int8"], [512, 128, 1, 1, "int8"], [1, 1], [0, 0], [1, 1], "NCHW", "int32"], {"i": 1466844436, "t": "int8", "c": null, "e": [["tile_n", "sp", [8, 1, 1, 4]], ["tile_f", "sp", [8, 2, 4, 2]], ["tile_y", "sp", [28, 1, 1, 1]], ["tile_x", "sp", [1, 1, 28, 1]], ["fuse_yx", "ot", 0], ["tile_rc", "sp", [8, 4]], ["tile_ry", "sp", [1, 1]], ["tile_rx", "sp", [1, 1]], ["AA_double_buffer", "ot", 1], ["WW_double_buffer", "ot", 1], ["auto_unroll_max_step", "ot", 1500], ["reorder_inner", "re", [0, 1, 2]]]}], "r": [[0.00021523079999999999], 0, 1.2301077842712402, 1542310652.629571], "v": 0.1}
{"i": ["cuda -model=1080", "topi_nn_conv2d", [["TENSOR", [32, 512, 28, 28], "int8"], ["TENSOR", [128, 512, 1, 1], "int8"], [1, 1], [0, 0], [1, 1], "NCHW", "int32"], {}, ["conv2d", [32, 512, 28, 28, "int8"], [128, 512, 1, 1, "int8"], [1, 1], [0, 0], [1, 1], "NCHW", "int32"], {"i": 368477536, "t": "int8", "c": null, "e": [["tile_n", "sp", [32, 1, 1, 1]], ["tile_f", "sp", [4, 2, 4, 1]], ["tile_y", "sp", [7, 2, 1, 2]], ["tile_x", "sp", [1, 1, 28, 1]], ["fuse_yx", "ot", 1], ["tile_rc", "sp", [8, 16]], ["tile_ry", "sp", [1, 1]], ["tile_rx", "sp", [1, 1]], ["AA_double_buffer", "ot", 0], ["WW_double_buffer", "ot", 0], ["auto_unroll_max_step", "ot", 512], ["reorder_inner", "re", [0, 1, 2]]]}], "r": [[0.0001716865], 0, 1.1782429218292236, 1542318506.785419], "v": 0.1}
{"i": ["cuda -model=1080", "topi_nn_conv2d", [["TENSOR", [32, 512, 28, 28], "int8"], ["TENSOR", [256, 512, 1, 1], "int8"], [2, 2], [0, 0], [1, 1], "NCHW", "int32"], {}, ["conv2d", [32, 512, 28, 28, "int8"], [256, 512, 1, 1, "int8"], [2, 2], [0, 0], [1, 1], "NCHW", "int32"], {"i": 83694892, "t": "int8", "c": null, "e": [["tile_n", "sp", [8, 1, 1, 4]], ["tile_f", "sp", [2, 2, 16, 1]], ["tile_y", "sp", [14, 1, 1, 1]], ["tile_x", "sp", [1, 1, 14, 1]], ["fuse_yx", "ot", 1], ["tile_rc", "sp", [32, 4]], ["tile_ry", "sp", [1, 1]], ["tile_rx", "sp", [1, 1]], ["AA_double_buffer", "ot", 0], ["WW_double_buffer", "ot", 0], ["auto_unroll_max_step", "ot", 512], ["reorder_inner", "re", [0, 1, 2]]]}], "r": [[0.0001221286], 0, 1.1463661193847656, 1542324233.972979], "v": 0.1}
{"i": ["cuda -model=1080", "topi_nn_conv2d", [["TENSOR", [32, 256, 14, 14], "int8"], ["TENSOR", [256, 256, 3, 3], "int8"], [1, 1], [1, 1], [1, 1], "NCHW", "int32"], {}, ["conv2d", [32, 256, 14, 14, "int8"], [256, 256, 3, 3, "int8"], [1, 1], [1, 1], [1, 1], "NCHW", "int32"], {"i": 591596278, "t": "int8", "c": null, "e": [["tile_n", "sp", [1, 8, 4, 1]], ["tile_f", "sp", [4, 1, 8, 2]], ["tile_y", "sp", [7, 1, 2, 1]], ["tile_x", "sp", [7, 1, 2, 1]], ["fuse_yx", "ot", 1], ["tile_rc", "sp", [64, 1]], ["tile_ry", "sp", [1, 3]], ["tile_rx", "sp", [1, 3]], ["AA_double_buffer", "ot", 0], ["WW_double_buffer", "ot", 0], ["auto_unroll_max_step", "ot", 1500], ["reorder_inner", "re", [0, 1, 2]]]}], "r": [[0.00031654029999999997], 0, 1.322192907333374, 1542332645.350062], "v": 0.1}
{"i": ["cuda -model=1080", "topi_nn_conv2d", [["TENSOR", [32, 256, 14, 14], "int8"], ["TENSOR", [1024, 256, 1, 1], "int8"], [1, 1], [0, 0], [1, 1], "NCHW", "int32"], {}, ["conv2d", [32, 256, 14, 14, "int8"], [1024, 256, 1, 1, "int8"], [1, 1], [0, 0], [1, 1], "NCHW", "int32"], {"i": 382056568, "t": "int8", "c": null, "e": [["tile_n", "sp", [4, 1, 2, 4]], ["tile_f", "sp", [32, 2, 4, 1]], ["tile_y", "sp", [7, 1, 2, 1]], ["tile_x", "sp", [1, 1, 14, 1]], ["fuse_yx", "ot", 1], ["tile_rc", "sp", [8, 8]], ["tile_ry", "sp", [1, 1]], ["tile_rx", "sp", [1, 1]], ["AA_double_buffer", "ot", 1], ["WW_double_buffer", "ot", 1], ["auto_unroll_max_step", "ot", 1500], ["reorder_inner", "re", [0, 1, 2]]]}], "r": [[0.0001781349], 0, 1.4745547771453857, 1542338772.260527], "v": 0.1}
{"i": ["cuda -model=1080", "topi_nn_conv2d", [["TENSOR", [32, 1024, 14, 14], "int8"], ["TENSOR", [256, 1024, 1, 1], "int8"], [1, 1], [0, 0], [1, 1], "NCHW", "int32"], {}, ["conv2d", [32, 1024, 14, 14, "int8"], [256, 1024, 1, 1, "int8"], [1, 1], [0, 0], [1, 1], "NCHW", "int32"], {"i": 182461196, "t": "int8", "c": null, "e": [["tile_n", "sp", [8, 1, 1, 4]], ["tile_f", "sp", [4, 1, 8, 2]], ["tile_y", "sp", [7, 1, 2, 1]], ["tile_x", "sp", [1, 1, 14, 1]], ["fuse_yx", "ot", 1], ["tile_rc", "sp", [32, 8]], ["tile_ry", "sp", [1, 1]], ["tile_rx", "sp", [1, 1]], ["AA_double_buffer", "ot", 0], ["WW_double_buffer", "ot", 0], ["auto_unroll_max_step", "ot", 1500], ["reorder_inner", "re", [0, 1, 2]]]}], "r": [[0.0001735814], 0, 0.9542479515075684, 1542347513.253534], "v": 0.1}
{"i": ["cuda -model=1080", "topi_nn_conv2d", [["TENSOR", [32, 1024, 14, 14], "int8"], ["TENSOR", [512, 1024, 1, 1], "int8"], [2, 2], [0, 0], [1, 1], "NCHW", "int32"], {}, ["conv2d", [32, 1024, 14, 14, "int8"], [512, 1024, 1, 1, "int8"], [2, 2], [0, 0], [1, 1], "NCHW", "int32"], {"i": 8226739, "t": "int8", "c": null, "e": [["tile_n", "sp", [4, 8, 1, 1]], ["tile_f", "sp", [8, 1, 16, 1]], ["tile_y", "sp", [7, 1, 1, 1]], ["tile_x", "sp", [1, 1, 7, 1]], ["fuse_yx", "ot", 0], ["tile_rc", "sp", [64, 4]], ["tile_ry", "sp", [1, 1]], ["tile_rx", "sp", [1, 1]], ["AA_double_buffer", "ot", 0], ["WW_double_buffer", "ot", 0], ["auto_unroll_max_step", "ot", 512], ["reorder_inner", "re", [0, 1, 2]]]}], "r": [[0.0001499334], 0, 0.8803131580352783, 1542354114.268985], "v": 0.1}
{"i": ["cuda -model=1080", "topi_nn_conv2d", [["TENSOR", [32, 512, 7, 7], "int8"], ["TENSOR", [512, 512, 3, 3], "int8"], [1, 1], [1, 1], [1, 1], "NCHW", "int32"], {}, ["conv2d", [32, 512, 7, 7, "int8"], [512, 512, 3, 3, "int8"], [1, 1], [1, 1], [1, 1], "NCHW", "int32"], {"i": 28117688, "t": "int8", "c": null, "e": [["tile_n", "sp", [1, 4, 4, 2]], ["tile_f", "sp", [16, 1, 8, 1]], ["tile_y", "sp", [7, 1, 1, 1]], ["tile_x", "sp", [1, 1, 7, 1]], ["fuse_yx", "ot", 1], ["tile_rc", "sp", [32, 4]], ["tile_ry", "sp", [3, 1]], ["tile_rx", "sp", [3, 1]], ["AA_double_buffer", "ot", 0], ["WW_double_buffer", "ot", 0], ["auto_unroll_max_step", "ot", 512], ["reorder_inner", "re", [0, 1, 2]]]}], "r": [[0.00045975290000000005], 0, 1.4204401969909668, 1542360158.690753], "v": 0.1}
{"i": ["cuda -model=1080", "topi_nn_conv2d", [["TENSOR", [1, 3, 224, 224], "int8"], ["TENSOR", [64, 3, 3, 3], "int8"], [1, 1], [1, 1], [1, 1], "NCHW", "int32"], {}, ["conv2d", [1, 3, 224, 224, "int8"], [64, 3, 3, 3, "int8"], [1, 1], [1, 1], [1, 1], "NCHW", "int32"], {"i": 195761936, "t": "direct", "c": null, "e": [["tile_f", "sp", [2, 4, 8, 1]], ["tile_y", "sp", [32, 7, 1, 1]], ["tile_x", "sp", [7, 1, 16, 2]], ["tile_rc", "sp", [3, 1]], ["tile_ry", "sp", [1, 3]], ["tile_rx", "sp", [1, 3]], ["auto_unroll_max_step", "ot", 1500], ["unroll_explicit", "ot", 1], ["reorder_inner", "re", [0, 1, 2]]]}], "r": [[3.84215e-05], 0, 1.3775010108947754, 1542368160.28082], "v": 0.1}
{"i": ["cuda -model=1080", "topi_nn_conv2d", [["TENSOR", [1, 64, 224, 224], "int8"], ["TENSOR", [64, 64, 3, 3], "int8"], [1, 1], [1, 1], [1, 1], "NCHW", "int32"], {}, ["conv2d", [1, 64, 224, 224, "int8"], [64, 64, 3, 3, "int8"], [1, 1], [1, 1], [1, 1], "NCHW", "int32"], {"i": 792402847, "t": "int8", "c": null, "e": [["tile_n", "sp", [1, 1, 1, 1]], ["tile_f", "sp", [2, 1, 8, 1]], ["tile_y", "sp", [16, 1, 1, 14]], ["tile_x", "sp", [14, 1, 16, 1]], ["fuse_yx", "ot", 1], ["tile_rc", "sp", [16, 1]], ["tile_ry", "sp", [1, 3]], ["tile_rx", "sp", [3, 1]], ["AA_double_buffer", "ot", 1], ["WW_double_buffer", "ot", 1], ["auto_unroll_max_step", "ot", 1500], ["reorder_inner", "re", [0, 1, 2]]]}], "r": [[0.0001515844], 0, 2.5292911529541016, 1542381923.007797], "v": 0.1}
{"i": ["cuda -model=1080", "topi_nn_conv2d", [["TENSOR", [1, 64, 112, 112], "int8"], ["TENSOR", [128, 64, 3, 3], "int8"], [1, 1], [1, 1], [1, 1], "NCHW", "int32"], {}, ["conv2d", [1, 64, 112, 112, "int8"], [128, 64, 3, 3, "int8"], [1, 1], [1, 1], [1, 1], "NCHW", "int32"], {"i": 495312959, "t": "int8", "c": null, "e": [["tile_n", "sp", [1, 1, 1, 1]], ["tile_f", "sp", [4, 1, 8, 1]], ["tile_y", "sp", [8, 2, 1, 7]], ["tile_x", "sp", [7, 1, 16, 1]], ["fuse_yx", "ot", 1], ["tile_rc", "sp", [16, 1]], ["tile_ry", "sp", [1, 3]], ["tile_rx", "sp", [3, 1]], ["AA_double_buffer", "ot", 1], ["WW_double_buffer", "ot", 1], ["auto_unroll_max_step", "ot", 1500], ["reorder_inner", "re", [0, 1, 2]]]}], "r": [[8.04234e-05], 0, 1.3321080207824707, 1542387143.636075], "v": 0.1}
{"i": ["cuda -model=1080", "topi_nn_conv2d", [["TENSOR", [1, 64, 56, 56], "int8"], ["TENSOR", [256, 64, 1, 1], "int8"], [1, 1], [0, 0], [1, 1], "NCHW", "int32"], {}, ["conv2d", [1, 64, 56, 56, "int8"], [256, 64, 1, 1, "int8"], [1, 1], [0, 0], [1, 1], "NCHW", "int32"], {"i": 46966870, "t": "int8", "c": null, "e": [["tile_n", "sp", [1, 1, 1, 1]], ["tile_f", "sp", [16, 1, 2, 2]], ["tile_y", "sp", [14, 2, 2, 1]], ["tile_x", "sp", [1, 1, 56, 1]], ["fuse_yx", "ot", 1], ["tile_rc", "sp", [2, 8]], ["tile_ry", "sp", [1, 1]], ["tile_rx", "sp", [1, 1]], ["AA_double_buffer", "ot", 0], ["WW_double_buffer", "ot", 0], ["auto_unroll_max_step", "ot", 1500], ["reorder_inner", "re", [0, 1, 2]]]}], "r": [[1.28407e-05], 0, 1.2082340717315674, 1542408326.827361], "v": 0.1}
{"i": ["cuda -model=1080", "topi_nn_conv2d", [["TENSOR", [1, 128, 112, 112], "int8"], ["TENSOR", [128, 128, 3, 3], "int8"], [1, 1], [1, 1], [1, 1], "NCHW", "int32"], {}, ["conv2d", [1, 128, 112, 112, "int8"], [128, 128, 3, 3, "int8"], [1, 1], [1, 1], [1, 1], "NCHW", "int32"], {"i": 595194783, "t": "int8", "c": null, "e": [["tile_n", "sp", [1, 1, 1, 1]], ["tile_f", "sp", [4, 1, 8, 1]], ["tile_y", "sp", [8, 1, 2, 7]], ["tile_x", "sp", [7, 1, 16, 1]], ["fuse_yx", "ot", 0], ["tile_rc", "sp", [16, 2]], ["tile_ry", "sp", [1, 3]], ["tile_rx", "sp", [3, 1]], ["AA_double_buffer", "ot", 1], ["WW_double_buffer", "ot", 1], ["auto_unroll_max_step", "ot", 1500], ["reorder_inner", "re", [0, 1, 2]]]}], "r": [[0.0001565465], 0, 2.1633172035217285, 1542413115.407757], "v": 0.1}
{"i": ["cuda -model=1080", "topi_nn_conv2d", [["TENSOR", [1, 128, 28, 28], "int8"], ["TENSOR", [512, 128, 1, 1], "int8"], [1, 1], [0, 0], [1, 1], "NCHW", "int32"], {}, ["conv2d", [1, 128, 28, 28, "int8"], [512, 128, 1, 1, "int8"], [1, 1], [0, 0], [1, 1], "NCHW", "int32"], {"i": 1426485, "t": "int8", "c": null, "e": [["tile_n", "sp", [1, 1, 1, 1]], ["tile_f", "sp", [8, 4, 2, 2]], ["tile_y", "sp", [7, 2, 2, 1]], ["tile_x", "sp", [1, 1, 28, 1]], ["fuse_yx", "ot", 1], ["tile_rc", "sp", [4, 8]], ["tile_ry", "sp", [1, 1]], ["tile_rx", "sp", [1, 1]], ["AA_double_buffer", "ot", 0], ["WW_double_buffer", "ot", 0], ["auto_unroll_max_step", "ot", 0], ["reorder_inner", "re", [0, 1, 2]]]}], "r": [[1.20785e-05], 0, 0.9150450229644775, 1542430726.673711], "v": 0.1}
{"i": ["cuda -model=1080", "topi_nn_conv2d", [["TENSOR", [1, 128, 56, 56], "int8"], ["TENSOR", [256, 128, 3, 3], "int8"], [1, 1], [1, 1], [1, 1], "NCHW", "int32"], {}, ["conv2d", [1, 128, 56, 56, "int8"], [256, 128, 3, 3, "int8"], [1, 1], [1, 1], [1, 1], "NCHW", "int32"], {"i": 292607382, "t": "int8", "c": null, "e": [["tile_n", "sp", [1, 1, 1, 1]], ["tile_f", "sp", [8, 1, 8, 1]], ["tile_y", "sp", [4, 1, 2, 7]], ["tile_x", "sp", [7, 1, 8, 1]], ["fuse_yx", "ot", 0], ["tile_rc", "sp", [8, 4]], ["tile_ry", "sp", [1, 3]], ["tile_rx", "sp", [3, 1]], ["AA_double_buffer", "ot", 1], ["WW_double_buffer", "ot", 1], ["auto_unroll_max_step", "ot", 1500], ["reorder_inner", "re", [0, 1, 2]]]}], "r": [[8.98339e-05], 0, 1.7887258529663086, 1542435843.151127], "v": 0.1}
{"i": ["cuda -model=1080", "topi_nn_conv2d", [["TENSOR", [1, 256, 56, 56], "int8"], ["TENSOR", [256, 256, 3, 3], "int8"], [1, 1], [1, 1], [1, 1], "NCHW", "int32"], {}, ["conv2d", [1, 256, 56, 56, "int8"], [256, 256, 3, 3, "int8"], [1, 1], [1, 1], [1, 1], "NCHW", "int32"], {"i": 250136982, "t": "int8", "c": null, "e": [["tile_n", "sp", [1, 1, 1, 1]], ["tile_f", "sp", [8, 1, 8, 1]], ["tile_y", "sp", [4, 1, 2, 7]], ["tile_x", "sp", [7, 1, 8, 1]], ["fuse_yx", "ot", 1], ["tile_rc", "sp", [32, 2]], ["tile_ry", "sp", [1, 3]], ["tile_rx", "sp", [3, 1]], ["AA_double_buffer", "ot", 0], ["WW_double_buffer", "ot", 0], ["auto_unroll_max_step", "ot", 1500], ["reorder_inner", "re", [0, 1, 2]]]}], "r": [[0.0001681008], 0, 1.4078898429870605, 1542442198.418137], "v": 0.1}
{"i": ["cuda -model=1080", "topi_nn_conv2d", [["TENSOR", [1, 256, 28, 28], "int8"], ["TENSOR", [512, 256, 3, 3], "int8"], [1, 1], [1, 1], [1, 1], "NCHW", "int32"], {}, ["conv2d", [1, 256, 28, 28, "int8"], [512, 256, 3, 3, "int8"], [1, 1], [1, 1], [1, 1], "NCHW", "int32"], {"i": 78579986, "t": "int8", "c": null, "e": [["tile_n", "sp", [1, 1, 1, 1]], ["tile_f", "sp", [8, 1, 16, 1]], ["tile_y", "sp", [2, 1, 2, 7]], ["tile_x", "sp", [7, 1, 4, 1]], ["fuse_yx", "ot", 1], ["tile_rc", "sp", [32, 2]], ["tile_ry", "sp", [1, 3]], ["tile_rx", "sp", [3, 1]], ["AA_double_buffer", "ot", 1], ["WW_double_buffer", "ot", 1], ["auto_unroll_max_step", "ot", 512], ["reorder_inner", "re", [0, 1, 2]]]}], "r": [[8.654809999999999e-05], 0, 1.3754429817199707, 1542450016.681341], "v": 0.1}
{"i": ["cuda -model=1080", "topi_nn_conv2d", [["TENSOR", [1, 512, 28, 28], "int8"], ["TENSOR", [512, 512, 3, 3], "int8"], [1, 1], [1, 1], [1, 1], "NCHW", "int32"], {}, ["conv2d", [1, 512, 28, 28, "int8"], [512, 512, 3, 3, "int8"], [1, 1], [1, 1], [1, 1], "NCHW", "int32"], {"i": 89715986, "t": "int8", "c": null, "e": [["tile_n", "sp", [1, 1, 1, 1]], ["tile_f", "sp", [8, 1, 16, 1]], ["tile_y", "sp", [2, 1, 2, 7]], ["tile_x", "sp", [7, 1, 4, 1]], ["fuse_yx", "ot", 1], ["tile_rc", "sp", [64, 2]], ["tile_ry", "sp", [1, 3]], ["tile_rx", "sp", [3, 1]], ["AA_double_buffer", "ot", 1], ["WW_double_buffer", "ot", 1], ["auto_unroll_max_step", "ot", 512], ["reorder_inner", "re", [0, 1, 2]]]}], "r": [[0.0001616887], 0, 1.211366891860962, 1542457342.138825], "v": 0.1}
{"i": ["cuda -model=1080", "topi_nn_conv2d", [["TENSOR", [1, 256, 56, 56], "int8"], ["TENSOR", [64, 256, 1, 1], "int8"], [1, 1], [0, 0], [1, 1], "NCHW", "int32"], {}, ["conv2d", [1, 256, 56, 56, "int8"], [64, 256, 1, 1, "int8"], [1, 1], [0, 0], [1, 1], "NCHW", "int32"], {"i": 13964707, "t": "int8", "c": null, "e": [["tile_n", "sp", [1, 1, 1, 1]], ["tile_f", "sp", [2, 1, 4, 2]], ["tile_y", "sp", [14, 2, 1, 2]], ["tile_x", "sp", [2, 1, 28, 1]], ["fuse_yx", "ot", 0], ["tile_rc", "sp", [8, 8]], ["tile_ry", "sp", [1, 1]], ["tile_rx", "sp", [1, 1]], ["AA_double_buffer", "ot", 0], ["WW_double_buffer", "ot", 0], ["auto_unroll_max_step", "ot", 512], ["reorder_inner", "re", [0, 1, 2]]]}], "r": [[1.14101e-05], 0, 0.9927389621734619, 1542475207.982128], "v": 0.1}
{"i": ["cuda -model=1080", "topi_nn_conv2d", [["TENSOR", [1, 256, 56, 56], "int8"], ["TENSOR", [512, 256, 1, 1], "int8"], [2, 2], [0, 0], [1, 1], "NCHW", "int32"], {}, ["conv2d", [1, 256, 56, 56, "int8"], [512, 256, 1, 1, "int8"], [2, 2], [0, 0], [1, 1], "NCHW", "int32"], {"i": 22516833, "t": "int8", "c": null, "e": [["tile_n", "sp", [1, 1, 1, 1]], ["tile_f", "sp", [2, 1, 64, 1]], ["tile_y", "sp", [28, 1, 1, 1]], ["tile_x", "sp", [1, 7, 4, 1]], ["fuse_yx", "ot", 1], ["tile_rc", "sp", [16, 4]], ["tile_ry", "sp", [1, 1]], ["tile_rx", "sp", [1, 1]], ["AA_double_buffer", "ot", 0], ["WW_double_buffer", "ot", 0], ["auto_unroll_max_step", "ot", 1500], ["reorder_inner", "re", [0, 1, 2]]]}], "r": [[2.3167399999999998e-05], 0, 1.2619800567626953, 1542491601.882416], "v": 0.1}
{"i": ["cuda -model=1080", "topi_nn_conv2d", [["TENSOR", [1, 3, 224, 224], "int8"], ["TENSOR", [16, 3, 7, 7], "int8"], [1, 1], [3, 3], [1, 1], "NCHW", "int32"], {}, ["conv2d", [1, 3, 224, 224, "int8"], [16, 3, 7, 7, "int8"], [1, 1], [3, 3], [1, 1], "NCHW", "int32"], {"i": 81572203, "t": "direct", "c": null, "e": [["tile_f", "sp", [1, 2, 8, 1]], ["tile_y", "sp", [32, 1, 1, 7]], ["tile_x", "sp", [7, 1, 16, 2]], ["tile_rc", "sp", [3, 1]], ["tile_ry", "sp", [1, 7]], ["tile_rx", "sp", [1, 7]], ["auto_unroll_max_step", "ot", 1500], ["unroll_explicit", "ot", 1], ["reorder_inner", "re", [0, 1, 2]]]}], "r": [[3.58701e-05], 0, 2.6295061111450195, 1542600528.044702], "v": 0.1}
{"i": ["cuda -model=1080", "topi_nn_conv2d", [["TENSOR", [1, 256, 14, 14], "int8"], ["TENSOR", [1024, 256, 1, 1], "int8"], [1, 1], [0, 0], [1, 1], "NCHW", "int32"], {}, ["conv2d", [1, 256, 14, 14, "int8"], [1024, 256, 1, 1, "int8"], [1, 1], [0, 0], [1, 1], "NCHW", "int32"], {"i": 6822933, "t": "int8", "c": null, "e": [["tile_n", "sp", [1, 1, 1, 1]], ["tile_f", "sp", [32, 2, 4, 1]], ["tile_y", "sp", [1, 2, 7, 1]], ["tile_x", "sp", [1, 1, 14, 1]], ["fuse_yx", "ot", 1], ["tile_rc", "sp", [8, 8]], ["tile_ry", "sp", [1, 1]], ["tile_rx", "sp", [1, 1]], ["AA_double_buffer", "ot", 1], ["WW_double_buffer", "ot", 1], ["auto_unroll_max_step", "ot", 1500], ["reorder_inner", "re", [0, 1, 2]]]}], "r": [[1.31001e-05], 0, 1.8091180324554443, 1542619228.999966], "v": 0.1}
{"i": ["cuda -model=1080", "topi_nn_conv2d", [["TENSOR", [32, 512, 28, 28], "int8"], ["TENSOR", [1024, 512, 1, 1], "int8"], [2, 2], [0, 0], [1, 1], "NCHW", "int32"], {}, ["conv2d", [32, 512, 28, 28, "int8"], [1024, 512, 1, 1, "int8"], [2, 2], [0, 0], [1, 1], "NCHW", "int32"], {"i": 164399852, "t": "int8", "c": null, "e": [["tile_n", "sp", [8, 1, 1, 4]], ["tile_f", "sp", [8, 2, 16, 1]], ["tile_y", "sp", [14, 1, 1, 1]], ["tile_x", "sp", [1, 1, 14, 1]], ["fuse_yx", "ot", 1], ["tile_rc", "sp", [32, 4]], ["tile_ry", "sp", [1, 1]], ["tile_rx", "sp", [1, 1]], ["AA_double_buffer", "ot", 0], ["WW_double_buffer", "ot", 0], ["auto_unroll_max_step", "ot", 512], ["reorder_inner", "re", [0, 1, 2]]]}], "r": [[0.00043588810000000003], 0, 0.9532060623168945, 1542635592.892554], "v": 0.1}
{"i": ["cuda -model=1080", "topi_nn_conv2d", [["TENSOR", [32, 512, 7, 7], "int8"], ["TENSOR", [2048, 512, 1, 1], "int8"], [1, 1], [0, 0], [1, 1], "NCHW", "int32"], {}, ["conv2d", [32, 512, 7, 7, "int8"], [2048, 512, 1, 1, "int8"], [1, 1], [0, 0], [1, 1], "NCHW", "int32"], {"i": 10570729, "t": "int8", "c": null, "e": [["tile_n", "sp", [16, 2, 1, 1]], ["tile_f", "sp", [64, 8, 1, 1]], ["tile_y", "sp", [1, 1, 7, 1]], ["tile_x", "sp", [1, 1, 7, 1]], ["fuse_yx", "ot", 1], ["tile_rc", "sp", [32, 4]], ["tile_ry", "sp", [1, 1]], ["tile_rx", "sp", [1, 1]], ["AA_double_buffer", "ot", 1], ["WW_double_buffer", "ot", 1], ["auto_unroll_max_step", "ot", 0], ["reorder_inner", "re", [0, 1, 2]]]}], "r": [[0.00024777610000000004], 0, 1.1105492115020752, 1542672997.362296], "v": 0.1}
{"i": ["cuda -model=1080", "topi_nn_conv2d", [["TENSOR", [1, 512, 7, 7], "int8"], ["TENSOR", [2048, 512, 1, 1], "int8"], [1, 1], [0, 0], [1, 1], "NCHW", "int32"], {}, ["conv2d", [1, 512, 7, 7, "int8"], [2048, 512, 1, 1, "int8"], [1, 1], [0, 0], [1, 1], "NCHW", "int32"], {"i": 421180, "t": "int8", "c": null, "e": [["tile_n", "sp", [1, 1, 1, 1]], ["tile_f", "sp", [128, 1, 1, 4]], ["tile_y", "sp", [1, 1, 7, 1]], ["tile_x", "sp", [1, 1, 7, 1]], ["fuse_yx", "ot", 1], ["tile_rc", "sp", [16, 8]], ["tile_ry", "sp", [1, 1]], ["tile_rx", "sp", [1, 1]], ["AA_double_buffer", "ot", 1], ["WW_double_buffer", "ot", 1], ["auto_unroll_max_step", "ot", 512], ["reorder_inner", "re", [0, 1, 2]]]}], "r": [[1.71314e-05], 0, 1.041675090789795, 1542716309.601927], "v": 0.1}
{"i": ["cuda -model=1080", "topi_nn_conv2d", [["TENSOR", [1, 1024, 14, 14], "int8"], ["TENSOR", [2048, 1024, 1, 1], "int8"], [2, 2], [0, 0], [1, 1], "NCHW", "int32"], {}, ["conv2d", [1, 1024, 14, 14, "int8"], [2048, 1024, 1, 1, "int8"], [2, 2], [0, 0], [1, 1], "NCHW", "int32"], {"i": 526268, "t": "int8", "c": null, "e": [["tile_n", "sp", [1, 1, 1, 1]], ["tile_f", "sp", [32, 2, 8, 1]], ["tile_y", "sp", [7, 1, 1, 1]], ["tile_x", "sp", [1, 1, 7, 1]], ["fuse_yx", "ot", 1], ["tile_rc", "sp", [64, 4]], ["tile_ry", "sp", [1, 1]], ["tile_rx", "sp", [1, 1]], ["AA_double_buffer", "ot", 0], ["WW_double_buffer", "ot", 0], ["auto_unroll_max_step", "ot", 1500], ["reorder_inner", "re", [0, 1, 2]]]}], "r": [[5.27629e-05], 0, 0.8452990055084229, 1542721611.139218], "v": 0.1}
